{
  "run_metadata": {
    "schema_name": "poc-accommodation-schema-v1",
    "schema_version": "0.2.0-poc",
    "category_taxonomy_version": "poc-subset-0.3",
    "generated_at": "2026-09-02T12:00:00Z"
  },
  "product_type": "accommodation",
  "fields": {
    "name": {
      "fi": {
        "status": "found",
        "value": "Villa Maija",
        "evidence": [
          {
            "source_id": "p002",
            "locator": "line 1",
            "excerpt": "Huvilamajoitus Villa Maija Hanko",
            "quote_verified": true
          }
        ]
      },
      "en": {
        "status": "missing"
      }
    },
    "description": {
      "fi": {
        "status": "found",
        "value": "Villa Maija on yksi Hangon tunnetuimmista pitsihuviloista ja avoinna vuoden jokaisena p\u00e4iv\u00e4n\u00e4. Villa Maija tarjoaa loistavan mahdollisuuden nopeaan irtiottoon arjesta. Y\u00f6pyminen aidossa 1800-luvun huvilassa Hangon paraatipaikalla on ainutlaatuinen el\u00e4mys.",
        "evidence": [
          {
            "source_id": "p002",
            "locator": "line 16-17",
            "excerpt": "Villa Maija on yksi Hangon tunnetuimmista pitsihuviloista ja avoinna vuoden jokaisena p\u00e4iv\u00e4n\u00e4.",
            "quote_verified": true
          }
        ]
      },
      "en": {
        "status": "missing"
      }
    },
    "address": {
      "status": "found",
      "value": {
        "street": "Appelgrenintie 7",
        "postal_code": "10900",
        "city": "Hanko"
      },
      "evidence": [
        {
          "source_id": "p002",
          "locator": "line 60",
          "excerpt": "Appelgrenintie 7, 10900 Hanko",
          "quote_verified": true
        }
      ]
    },
    "coordinates": {
      "status": "review",
      "value": {
        "latitude": 59.8236528,
        "longitude": 22.9718909
      },
      "evidence": [
        {
          "source_id": "p002",
          "locator": "line 97",
          "excerpt": "Appelgrenintie 7, 10900 Hanko -> https://www.google.com/maps/place/Appelgrenintie+7,+10900+Hanko/@59.8236528,22.9718909,1129m"
        }
      ],
      "notes": "Coordinates are derived from the numeric parameters embedded in a Google Maps link associated with the address, not from an explicit coordinate statement on the page. Treated as review rather than found because the map-centering parameter is an inference, not a direct statement of the property's coordinates."
    },
    "contact": {
      "status": "found",
      "value": {
        "email": "hello@hangofarm.fi",
        "phone": "+358 50 505 2013",
        "website": "https://hangofarm.fi/"
      },
      "evidence": [
        {
          "source_id": "p002",
          "locator": "line 61",
          "excerpt": "hello@hangofarm.fi",
          "quote_verified": true
        },
        {
          "source_id": "p002",
          "locator": "line 62",
          "excerpt": "+358 50 505 2013",
          "quote_verified": true
        },
        {
          "source_id": "p001",
          "locator": "line 137",
          "excerpt": "(no link text) -> https://hangofarm.fi/",
          "quote_verified": true
        }
      ]
    },
    "categories": {
      "status": "review",
      "value": [
        "apartment",
        "guest_house"
      ],
      "evidence": [
        {
          "source_id": "p002",
          "locator": "line 20",
          "excerpt": "Villa Maijan vanhat huoneet on saneerattu ylellisiksi puuhuvila-asunnoiksi."
        }
      ],
      "notes": "Villa Maija is repeatedly described as a historic 'huvila' (villa) divided into furnished 'huoneisto' (apartment) units offered for short-term stays; the PoC taxonomy has no dedicated 'villa' category, so 'apartment' and 'guest_house' are the closest matches. Category assignment is a classification judgment and is always review, never found, per policy."
    },
    "accessibility": {
      "status": "missing"
    },
    "sustainability_label": {
      "status": "missing"
    },
    "stf_status": {
      "status": "missing"
    },
    "capacity": {
      "status": "review",
      "value": {
        "rooms": 4
      },
      "evidence": [
        {
          "source_id": "p002",
          "locator": "line 24-28",
          "excerpt": "Huoneistot:\nVilla Maija 1 Eastside\nVilla Maija 2 Southside\nVilla Maija 3 Westside\nVilla Maija 4 Upperside"
        },
        {
          "source_id": "p002",
          "locator": "line 23",
          "excerpt": "Voit varata majoituksen Villa Maijasta 1-6:lle hengelle per huoneisto."
        },
        {
          "source_id": "p002",
          "locator": "line 41",
          "excerpt": "Majoitamme hieman seurueesta riippuen 12-19 henke\u00e4."
        }
      ],
      "notes": "4 named apartments are explicitly listed (rooms=4). No explicit 'beds' integer is stated; instead the source gives guest-capacity ranges: 1-6 people per apartment, and 12-19 people for the whole villa depending on group composition. Marked review because 'beds' cannot be derived as a single integer from stated guest-capacity ranges."
    },
    "pricing": {
      "status": "missing"
    },
    "booking_url": {
      "status": "found",
      "value": "https://villamaija.guestybookings.com/",
      "evidence": [
        {
          "source_id": "p002",
          "locator": "line 91",
          "excerpt": "Varaa majoitus -> https://villamaija.guestybookings.com/",
          "quote_verified": true
        }
      ]
    },
    "availability": {
      "status": "found",
      "value": {
        "open_year_round": true,
        "minimum_stay_nights": 1,
        "notes": "Minimi y\u00f6pyminen on yksi y\u00f6, ja kes\u00e4ll\u00e4 kes\u00e4kuu-elokuu kolme y\u00f6t\u00e4. Avaamme my\u00f6s kes\u00e4ll\u00e4 mahdollisuuden lyhyempiin y\u00f6pymisiin, jos majoitusten v\u00e4lille j\u00e4\u00e4 tyhji\u00e4 \u00f6it\u00e4."
      },
      "evidence": [
        {
          "source_id": "p002",
          "locator": "line 23",
          "excerpt": "Villa Maija on auki vuoden jokaisena p\u00e4iv\u00e4n\u00e4, viikon jokainen p\u00e4iv\u00e4.",
          "quote_verified": true
        },
        {
          "source_id": "p002",
          "locator": "line 23",
          "excerpt": "Minimi y\u00f6pyminen on yksi y\u00f6, ja kes\u00e4ll\u00e4 kes\u00e4kuu-elokuu kolme y\u00f6t\u00e4.",
          "quote_verified": true
        }
      ]
    },
    "opening_hours": {
      "status": "missing"
    },
    "amenities": {
      "status": "found",
      "value": [
        "private bathroom (shower and toilet) in every apartment",
        "air conditioning",
        "washing machine",
        "fully equipped kitchen",
        "shared terrace for all guests",
        "sauna (Villa Maija 2 Southside only)"
      ],
      "evidence": [
        {
          "source_id": "p002",
          "locator": "line 20",
          "excerpt": "Kaikissa huoneistoissa on omat kylpyhuoneet (suihku ja wc) sek\u00e4 uudenaikaiset ilmastointilaitteet sek\u00e4 pyykkikone.",
          "quote_verified": true
        },
        {
          "source_id": "p002",
          "locator": "line 20",
          "excerpt": "Huoneistossa nro 2 Southside on my\u00f6s oma sauna.",
          "quote_verified": true
        },
        {
          "source_id": "p002",
          "locator": "line 20",
          "excerpt": "Uudistuksen yhteydess\u00e4 jokaiseen huoneistoon rakennettiin my\u00f6s t\u00e4ysin varusteltu keitti\u00f6.",
          "quote_verified": true
        },
        {
          "source_id": "p002",
          "locator": "line 20",
          "excerpt": "Huoneistot ovat tilavia ja kaikki vieraat saavat k\u00e4ytt\u00e4\u00e4 yhteist\u00e4 terassia.",
          "quote_verified": true
        }
      ]
    },
    "languages_spoken": {
      "status": "missing"
    },
    "images": {
      "status": "not_in_scope"
    }
  },
  "scope_decision_ref": "scope-decision-run-12b0276d658a",
  "validation": {
    "valid": true,
    "errors": [],
    "warnings": []
  }
}